{
  "$schema": "https://json-schema.org/draft/2020-12/schema",
  "$id": "https://skenion.dev/schemas/project/v0.2/project.schema.json",
  "title": "Skenion Project Document v0.2",
  "type": "object",
  "required": ["schema", "schemaVersion", "id", "revision", "graph", "viewState", "patchLibrary"],
  "properties": {
    "schema": {
      "const": "skenion.project"
    },
    "schemaVersion": {
      "const": "0.2.0"
    },
    "id": {
      "type": "string",
      "minLength": 1
    },
    "revision": {
      "type": "string",
      "minLength": 1
    },
    "metadata": {
      "$ref": "#/$defs/metadata"
    },
    "graph": {
      "$ref": "https://skenion.dev/schemas/graph/v0.2/graph.schema.json"
    },
    "viewState": {
      "$ref": "https://skenion.dev/schemas/view/v0.1/view-state.schema.json"
    },
    "patchLibrary": {
      "type": "array",
      "items": {
        "$ref": "#/$defs/patchDefinition"
      }
    },
    "tutorial": {
      "type": "object",
      "additionalProperties": true
    },
    "help": {
      "type": "object",
      "additionalProperties": true
    }
  },
  "additionalProperties": false,
  "$defs": {
    "metadata": {
      "type": "object",
      "properties": {
        "title": {
          "type": "string"
        },
        "description": {
          "type": "string"
        },
        "createdAt": {
          "type": "string"
        },
        "updatedAt": {
          "type": "string"
        }
      },
      "additionalProperties": true
    },
    "patchDefinition": {
      "type": "object",
      "required": ["id", "revision", "graph"],
      "properties": {
        "id": {
          "type": "string",
          "minLength": 1
        },
        "revision": {
          "type": "string",
          "minLength": 1
        },
        "metadata": {
          "$ref": "#/$defs/metadata"
        },
        "graph": {
          "$ref": "https://skenion.dev/schemas/graph/v0.2/graph.schema.json"
        },
        "viewState": {
          "$ref": "https://skenion.dev/schemas/view/v0.1/view-state.schema.json"
        }
      },
      "additionalProperties": false
    }
  }
}
